{
  "graphDigest": "554ddf503535f55c021c44f4cc787289feed22767a1c86c674d786906c2f34f2",
  "approvalDigest": "fdd0cce419f4b582a31966cd89c6aaf69cd4bbba3d3334c24e779d26a45989d0",
  "outcome": "Pass",
  "artifactRef": "specs/006-tui-functional-contract/evidence/dependency-preflight.md#sha256=0dd0a2ad2c7146d3fb17c8272fb6d8c6704069558c4db133165247b3934cf94b"
}
